,Date,Review,UserName
1431,22-Sep-17,"8 plus has best cam in the market, this sounds very good for iPhone X!
 
Â?Apple iPhone 8 Plus reviewed: The best smartphone camera weÂÂÂ?ve ever tested
 
Â?Overall, the Apple iPhone 8 Plus is an excellent choice for the needs of nearly every smartphone photographer. It features outstanding image quality, zoom for those needing to get closer to their subjects, and an industry-leading Portrait mode for artistic efforts. It is at the top of our scoring charts in nearly every category Â? and in particular, its advanced software allows it to do an amazing job of capturing high-dynamic range scenes and images in which it can recognize faces.Â?",Anonymous
1432,22-Sep-17,wonderfull ,Anonymous
1433,22-Sep-17,"Duel, 22 Sep 2017""There's a leaked information which is there's only cost USD300 to make an iPhone X""

it's o... moreThat's huge difference, 900USD. The cost to make an S8 around 200USD and the price of S8 is 600USD. The difference only 400USD. Apple just make too much profit.",TheShadow
1434,22-Sep-17,"Well I am an Apple lover . so many mouths and so many opinions . For me there is no one on earth who can challenge apple security system. APPLE is the best . Apple X is the best so far. waiting and dying to buy one for me. 
Thanks Apple",Anonymous
1435,22-Sep-17,"Nice
",jay
1436,22-Sep-17,"Andrey201, 22 Sep 2017There's a leaked information which is there's only cost USD300 to make an iPhone X. But the pr... more""There's a leaked information which is there's only cost USD300 to make an iPhone X""
 
it's only cost of parts, do you think the device just magically build itself and goes to stores for you to buy?",Duel
1437,22-Sep-17,"Theprfesssor, 21 Sep 2017If you really need a iPhone this is what you should get, its going to be better then the 8 in ... moreThere's a leaked information which is there's only cost USD300 to make an iPhone X. But the price on iPhone X is far higher which is cost USD1200! I mean, WTF?!?",Anonymous
1438,22-Sep-17,"The Iphone X will be a complete waste of money. Samsung and other Android companies have been using this technology for YEARS! Apple takes this technology, calls it their own, and sells it for 100's of dollars more. I don't get how people don't realize this!!! Apple new ""innovative"" screen that has ""never been done before"" was made by Samsung. Apple bought the OLED screen from Samsung and calls it new and innovative!!! Its absolutely pathetic that Apple is able to get away with selling a phone for $200 more than the competitors with the competitors technology from years ago. Apple is basically the definition of plagiarism. ",Anonymous
1439,22-Sep-17,X looks great with then 8..!!,mirza
1440,22-Sep-17,"Will considering it on my next upgrading.
",iLoveEeEe
1441,22-Sep-17,wow. what a piece of crap. apple is expecting for people to buy this?!,NOAH THOR
1442,21-Sep-17,"Apple Sucks D, 21 Sep 2017Face ID really??? The Samsung s4 had that and apple only ""discovers"" it now. Buying this would... moreÂ?The Samsung s4 had that and apple only ""discovers"" it now.Â?
 
And did anyone used it? NO! whatÂ?s the point to bring badly implemented tech early instead spending lot of time to make the tech good so tens of millions of people actually starting to use it.",Anonymous
1443,21-Sep-17,cant wait to buy it ,the beast
1444,21-Sep-17,"If you really need a iPhone this is what you should get, its going to be better then the 8 in every way for only $200 more, o and you will finally get a decent screen resolution for a apple........... finally",Theprfesssor
1445,21-Sep-17,iPhone X? another sh.it for business?,penjahad
1446,21-Sep-17,"Tim Cook: This is the futuristic phone! 
Me: I don't buy your ""cheap"" phone! 
Me again: I better buy a Galaxy S6.",A guy
1447,21-Sep-17,Come on Apple... 64gb jump to 256gb..??? What happened to 128gb who needs 256gb... Come on... Man ,Joey 
1448,21-Sep-17,Everything Looks Bad Except To Be Honest The Benchmark Is On Top Of All Device! ,X (2017)
1449,21-Sep-17,"Face ID really??? The Samsung s4 had that and apple only ""discovers"" it now. Buying this would be the same as buying a Samsung s6. Waste of money and time.",Apple Sucks D
1450,21-Sep-17,"Vipul kajla, 20 Sep 2017Lol.... Lol.... Lol.... My Xiaomi MiA1 also has face id 
Come on Apple grow up 
Who will spe... moreI believe that Face ID was released by Google on Android Jelly Bean or Ice cream about five years ago",Anonymous
1451,21-Sep-17,[deleted post]Don't lie..,Anonymous
1452,21-Sep-17,only stupid thing is with this phone its way to pricey with no fast charging as you after spend nearly £60 for you to have the fast charging to work,Anonymous
1453,21-Sep-17,To me X looks like a senior phone. No offense... :),Mcsteppe
1454,21-Sep-17,"The lack of this feature is a big deal breaker for some people;
https://www.cnet.com/news/apples-iphone-x-iphone­-8-lack-one-feature-on-the-galaxy-s8/ ",Anonymous
1455,20-Sep-17,"Vipul kajla, 20 Sep 2017Lol.... Lol.... Lol.... My Xiaomi MiA1 also has face id 
Come on Apple grow up 
Who will spe... moreWTH!! Mi A1 has face ID ha... ROFL!!! Nuts..",ss
1456,20-Sep-17,"Lol.... Lol.... Lol.... My Xiaomi MiA1 also has face id  
Come on Apple grow up  
Who will spend 1.02lac rupees  
A mad person will only spend that much money",Anonymous
1457,20-Sep-17,"Anonymous, 16 Sep 2017Plan lockdown and lose 64gb in the process?? And if 600$ can cover the phone cost, it also mea... moreI am already in combo 6 plan, and due for renewal every year due to singtel home. I also want to renew to get the new unlimited calls offer for combo 3 and above. If cannot get hand to iPX by 31st December, then will go for S8+ and use my iP7+ for another year and sell off S8+.  
64 GB is enough for me as photos I download to my Mac regularly and backed up in google photos. ",Anonymous
1458,20-Sep-17,"andres, 20 Sep 2017But i'd say, biggest thing is the price difference between EU and US. 
at the moment it has a... moreSome of it is VAT, and americans pay sales tax depending on where in usa they live so the usd price may be misleading. The hong kong price is more representable, no vat and no added taxes, the same price for everyone. ",Anonymous
1459,20-Sep-17,"But i'd say, biggest thing is the price difference between EU and US.  
at the moment it has a difference of 392 Euros. for the ophone x 256 GB version, and that is alot, for that money i can go to US buy the phone, fly back and still have some money over.  
why is there souch a big difference. ? ",andres
1460,20-Sep-17,"Cpt. Power, 19 Sep 2017Man its not true. Having Lenovo phone with 3Gb ram. In my case vibeshot and works like charm e... more""And i guarantee you that some games wont run smoothly even on this phone.""
 
you are wrong, every games run perfectly smooth with iPhones, you know the games are designed for iPhone hardware, thats the difference when you have hundreds of android phone with some devices games run better and with some others they are laggy. That's something what doesn't happen with Apple devices.
 
 ""3Gb ram is good only for apple Ios. But when we run certain apps this phone will be slow as any other with 3GB ram or less.""
 
And again you are wrong, adding more RAM makes very small difference for app loading times, it's a CPU thing. And this phone is by the way speed deamon :) for example one reviewer opened injustice 2 game with note 8 and iPhone 8 and loading time was two times faster with iPhone 8, which is just crazy how far ahead Apple is with their CHIP.",Duel
1461,20-Sep-17,"Duel, 19 Sep 2017""No one said android devices needed 8gb of RAM because its an android""

but they do need, iv... moreThats software issues..not my issue..they simply do not know how to use the hardware and software to its full potential",Anonymous
1462,20-Sep-17,Why didnÂ?t Apple keep a small bezel at the top and hoise all the cameras and sensors there? The design would be great then. This cut out at the top looks so bad to me. ,Tareq
1463,20-Sep-17,"Cpt. Power, 19 Sep 2017Pros: 
Low battery as every apple heavy users and gamers find this phone useless charnging it... more""A11 bionic which is too new not properly tested and very expensive"" Do you think Apple and Samsung/TSMC(these manufactured A11 BTW) as lame companies to not properly test its chipsets? Every other company, which has their own manufacturing facilities will do proper testing before releasing their products into market. Samsung is the sole manufacturer of iPhone X's AMOLEDs. So there is no question of copying here. Just get to know yourself about where Apple gets its parts from and then talk. 5.8"" screen in a body of 5.1"" phone, so that's not too big to handle. It's 174 g not 174 kgs to make users unable to carry it. I slightly agree with you on the design front though, they could have avoided the cutout and provided better design for the back. Those things would be corrected in its successor, if it ever gets one.",Anonymous
1464,20-Sep-17,"Cpt. Power, 19 Sep 2017Man its not true. Having Lenovo phone with 3Gb ram. In my case vibeshot and works like charm e... more""And i guarantee you that some games wont run smoothly even on this phone.  
3Gb ram is good only for apple Ios. But when we run certain apps this phone will be slow as any other with 3GB ram or less."" I had iPhone 6s with me for about 15 months until its motherboard died and during those months i had never experienced what you are saying here. 6s was never slow during game play, even while playing Infinity Blade game series. And i am not expecting iPhone 8s and Xs to be slow either. Buddy, iPhones' strong point is iOS and its smoothness all through. My 6s was working like a charm till that dreadful day, and i only think 8s and Xs as definitely far better in performance. Only things i didn't like in iPhone X are as usual its exorbitant price tag and camera(even though Apple mentioned it as new sensor, but i feel it is a remodeled 7+ sensor). When you are charging $999 for a phone, one will expect a different camera sensor than what you will get in an 8+.",Anonymous
1465,20-Sep-17,"Every year around this time Apple releases its new iPhones and every year we get a few early reviews in just before the phone goes on sale. 
But this time, Apple has a more interesting phone coming out in November - the iPhone X - casting a shadow over the iPhone 8 and iPhone 8 Plus - are they still worth it with a design dating back to 2014? Let's see what the reviewers say.
 
The consensus is that the Apple iPhone 8 and 8 Plus are let down by a tired design that's built on huge bezels and familiar aesthetics, but the new camera, wireless charging and chip partially make up for it. 
Engadget praises the iPhone 8 duo on the new excellent camera and a promising AR implementation but takes a point away for the design, despite the use of ""grippier"" glass. 
TheVerge makes mostly the same points - fast new processor, excellent camera and having wireless charging is nice. But Nilay Patel isn't too thrilled with the stiff design either. 
TechCrunch focuses on the new camera of the iPhone 8 Plus in their review hailing the new 12MP main camera as killer and the 8 Plus's Portrait Lighting as ""working better than it has any right to"". 
The same theme continues with The Telegraph - praise for the significantly improved camera and the new faster chipset. The new glass back gets a positive mention too. 
The New York Times review brands the new iPhones as the ""ultimate refinement before eternal retirement"". 
The Wall Street Journal (subscription required) is the only media that outright advises you avoid the iPhone 8 on the grounds that the 8 doesn't do enough to be considered more than a 7s, slightly better camera notwithstanding. 
John Gruber aka the Daring Fireball brands the iPhone 8 and 8 Plus ""pretty good for a boring update"". 
CNET would have you wait to see the iPhone X before deciding on buying either an iPhone 8 or 8 Plus. 
In its brief write-up USA Today describes the new glass and metal design as ""lovely"". 
Wired shares TechCrunch' sentiment that the new camera is kick-ass. It also hails the glass design as a big improvement coupled with wireless charging. 
Anyway we'll have even more to say when we get our hands on the new iPhones - camera samples, battery tests, loudspeaker test - all that jazz. So stay tuned!",user
1466,20-Sep-17,I would buy this phone just for the BBOS 10 feeling that it gives.,Anonymous
1467,19-Sep-17,"Stuart Reeves, 19 Sep 2017My sister's S5 has no burn in since 2014 up to now. I admired the OLED on my sister's S5 that'... moreThey don't burn, but they explode In your face.",Anonymous
1468,19-Sep-17,"Duel, 19 Sep 2017Keep dreaming https://youtu.be/jDL-9ARikqA after few apps in second round XZ reload every app.... morehttps://m.youtube.com/watch?v=I_W-Hc23rUA  phone battle is better and trusted than your crappy page",Xxx
1469,19-Sep-17,"Xxx, 19 Sep 2017But xperia xz premium with only 4giga ram crushed your iphone 7 plus with 3gb ram in speed tes... moreKeep dreaming https://youtu.be/jDL-9ARikqA  after few apps in second round XZ reload every app. This is perfect example showing how superior iPhone RAM management is.",Anonymous
1470,19-Sep-17,"Duel, 19 Sep 2017iPhone can do everything with 3GB where android devices needs 8GB, don't be so easily brainwas... moreBut xperia xz premium with only 4giga ram crushed your iphone 7 plus with 3gb ram in speed test even test a biased for apple ( in reopening app apps don't reload properly on apple because it show just screenshot but this guy skip). And i bet xz premium will beat again your iphone x with your a11 bionic on speed test. ",Xxx
1471,19-Sep-17,"ikky23, 19 Sep 2017probability is 1/1,000,000.if you search for iphone getting bluescreen you will also see plenty of videos...",Anonymous
1472,19-Sep-17,"Optimist Prime, 19 Sep 2017Can a fingerprint sensor be bypassed if you take a 3D render of the owner's finger?You can unlock the person phone while they are sleeping using their fingerprint. They wont even noticed. That the only kind of hack people told me. ",Anonymous
1473,19-Sep-17,"Luxor, 19 Sep 2017Can FaceID be hacked if I for instance, make a 3D sculpture of the person face to unlock his/h... moreCan a fingerprint sensor be bypassed if you take a 3D render of the owner's finger?",Anonymous
1474,19-Sep-17,"Anonymous, 19 Sep 2017Oh really?? S5/N5 burn-in was stinky terrible. Heck even the Galaxy S8 has garbage looking bur... moreMy sister's S5 has no burn in since 2014 up to now. I admired the OLED on my sister's S5 that's why I switched to Samsung after using iPhone for 7 months. The S5's display can still compete with the new generation of smartphones IMO.
 
And if Apple claims no burn in for iPhone X, then it is logical to say that Samsung smartphones has no burn in as well. Samsung is the supplier of OLED to Apple. You said that S8 has ""garbage looking burn in"". iPhone X is vulnerable to ""garbage looking burn in"" as well!",Anonymous
1475,19-Sep-17,"Mr Gabz, 19 Sep 2017The phone looks nice and modern but I did not like frankly the wireless recharge method. Just ... moreThis type of charging is easier to implement outside, as there is no need to care about what ports you have, and you don't need to carry wires.
 
And to add to that since Apple is also on the Qi standard and adding new protocols, we will see the rise of wireless battery packs, that can recharge wirelessly on those pads, as well as charging your phone on the go. And maybe lead to power sharing, putting phones to each other or battery packs to each other will charge the lower battery ones.
 
And if you have enough of such places around charging your phone faster then usage, you will not feel the restriction you say. Unless you are the type that uses your phone 24/7 without a single rest... then i call that over addiction.",WE NEED MOUSE.
1476,19-Sep-17,"Luxor, 19 Sep 2017Can FaceID be hacked if I for instance, make a 3D sculpture of the person face to unlock his/h... moreprobability is 1/1,000,000.",ikky23
1477,19-Sep-17,"REALperson, 19 Sep 2017No one said android devices needed 8gb of RAM because its an android...they just do that to ma... more""No one said android devices needed 8gb of RAM because its an android""
 
but they do need, iv seen endless speed test videos where android phones can't keep apps ready in background if those phones doesn't have atleast 6GB",Duel
1478,19-Sep-17,"Anonymous, 19 Sep 2017its not android - so hacking will be 100 times tough 100 times tough? Meanwhile, Apple admit if you have a twin it can trip the system. Lol. ",Anonymous
1479,19-Sep-17,"Salmando, 19 Sep 2017Gee, settle down hater.

Sure, this phone isn't anything hugely special, but it's still a hu... moreMan desogn is ugly. Phone looks like someone bite top of the screen like is apple on back.  
To me it seems a worm slowly eating apple and soon or later this company will be sold or bancrupt. Its just asking too much,  
They had a retina display which was good but now they copying samsung technology and yet they do not shame to ask for a partial copy product 1150 eur.  
By the way as every apple heating or not battery die fast. Especialy when used for 4k recording because lot of people will try that and they will be shocked how fast the phone died i mean battery.  
For Example Sony Z5 premium on 4k lasted like 45-50 mins and battery died. And it had 3430 mAh. When i look at all previous apple phones noone had battery over 2000 mAh. Apart from 7plus 2900. But for almost 6 inch screen it will be like joke i mean battery capacity.  
For example oukitel K10000 pro have 10150 mAh battery 5,5 inch screen 3GB ram 32 Gb disk space 8 core processor and cost only 220 eur. ",Anonymous
1480,19-Sep-17,"Duel, 19 Sep 2017iPhone can do everything with 3GB where android devices needs 8GB, don't be so easily brainwas... moreMan its not true. Having Lenovo phone with 3Gb ram. In my case vibeshot and works like charm even after 2 years bought it 2 months after release and still its my best phone i ever had other phones doesnt last me that long.  
And i guarantee you that some games wont run smoothly even on this phone.  
3Gb ram is good only for apple Ios. But when we run certain apps this phone will be slow as any other with 3GB ram or less. ",Anonymous
1481,19-Sep-17,"The phone looks nice and modern but I did not like frankly the wireless recharge method. Just though a smarter wireless technology to be offered. can anyone find any person that is willing to sit at the airport waiting his phone to recharge and not to use it? imagine yourself just waiting you phone to recharge, at least when there is a cable you can recharge and use. thats my opinion with due respect.",Mr Gabz
1482,19-Sep-17,"Duel, 19 Sep 2017iPhone can do everything with 3GB where android devices needs 8GB, don't be so easily brainwas... moreNo one said android devices needed 8gb of RAM because its an android...they just do that to make customers feel that its better..because higher number=better specs to them",Anonymous
1483,19-Sep-17,"Cpt. Power, 19 Sep 2017Pros: 
Low battery as every apple heavy users and gamers find this phone useless charnging it... moreGee, settle down hater.
 
Sure, this phone isn't anything hugely special, but it's still a huge step in the right direction for Apple, which has been stagnant for years now.
 
A lot of people live the design. Personally, on the internet I think it looks nice enough, though if place it behind both the galaxy phones and the mi mix. In real life I might like it more, I didn't like how tall and thin the s8 was. Plenty of people will consider this the most beautiful phone - especially those with Samsung hate.
 
The processor is a gamble. On paper, it looks to be a huge leap on existing tech. But you're correct that it's had limited testing, can't wait to see the heat generation.
 
Copy Samsung's screen? It is Samsung's screen - nothing wrong with that. Probably the best mobile screens around, so good going Apple.
 
Overall, I think the phone is nothing exciting, but it does compete with the best phones out there. Apples planned augmented reality future seems a bad choice to me, buy here's hoping they do something good with it. Hard to imagine anything not gimmicky, the tech has been around for ages without being useful. Hololens seems the way to go get",Anonymous
1484,19-Sep-17,"Luxor, 19 Sep 2017Can FaceID be hacked if I for instance, make a 3D sculpture of the person face to unlock his/h... moreits not android - so hacking will be 100 times tough ",Anonymous
1485,19-Sep-17,"Luxor, 19 Sep 2017Can FaceID be hacked if I for instance, make a 3D sculpture of the person face to unlock his/h... moreI think Ethan Hunt would get it open!",Duel
1486,19-Sep-17,"Still limit features,sorry Apple you won't win my heart..Save money first and waiting iPhone XXX",Anonymous
1487,19-Sep-17,"Can FaceID be hacked if I for instance, make a 3D sculpture of the person face to unlock his/her iphone X? It makes me wonder. ",Anonymous
1488,19-Sep-17,"Cpt. Power, 19 Sep 2017Pros: 
Low battery as every apple heavy users and gamers find this phone useless charnging it... moreiPhone can do everything with 3GB where android devices needs 8GB, don't be so easily brainwashed by paper specs.",Duel
1489,19-Sep-17,"rakesh kumar, 18 Sep 2017nobody can compete samsung in display technologyLG has way better TV displays than Samdung. Get your facts straight.",realist
1490,19-Sep-17,"Anonymous, 18 Sep 2017Hahahahh, really? 

Right here in GSMarena is the source of that comment, if you read you'll... moreOh really?? S5/N5 burn-in was stinky terrible. Heck even the Galaxy S8 has garbage looking burn-in. iPhone X they claim no burn-in.",Anonymous
1491,19-Sep-17,"Pros:  
Low battery as every apple heavy users and gamers find this phone useless charnging it 2-3 times a day even a brand new.. 
Bitten chunk of top display. 
4K recording which will drain your battery in like 20-30 mins from full. 
Only 3gb Ram. 
A11 bionic which is too new not properly tested and very expensive. 
Doesnt Support memory card. 
Back panel looks like traffic lights.  
Ugly design which will interest few people if any.  
174 gram weight which should be too heavy for some users.  
5,8 inch screen which shoudl be too big to some users.  
Super Amoled display which is copy from Samsung.  
Only scratch resistant glass instead of gorrila glass 5 or something better. 
No jack for headphones. 
Very high price for nothing special from Iphone 7 or 7 plus. 
 
Cons: All above plus lot of stupid people who buy no matter what because of apple. ",Anonymous
1492,18-Sep-17,battery mah ???,Anonymous
1493,18-Sep-17,"rakesh kumar, 18 Sep 2017nobody can compete samsung in display technologyBe patient, Joled is coming next year. ",Anonymous
1494,18-Sep-17,"noim1234, 17 Sep 2017I think GSM Arena made a mistake . its not Super Amoled , its Super Retina display :D :D :D ..... moreHilarious xD",Anonymous
1495,18-Sep-17,"Anonymous, 18 Sep 2017""It's the same oled display which samsung used in S5 and note 4. It can't match the display of... moreHahahahh, really? 
 
Right here in GSMarena is the source of that comment, if you read you'll find out the investment Apple did, paying Samsung for the OLED screens that the iPhone X's going to carry, plus, Samsung didn't even give them its awesome display, the iPhone X's screen can be compared to just as the guy said, S5/Note4.",Anonymous
1496,18-Sep-17,"rakesh kumar, 18 Sep 2017nobody can compete samsung in display technologyLG can. Apple is using Samsung's amoled.",Anonymous
1497,18-Sep-17,"iPhone x is the top  powerful device but next pixel will fight them.  
There's 2 best phone brand in the world : 
iPhone  
Pixel",Apaaap
1498,18-Sep-17,"Mike Greene, 18 Sep 2017Are you real? I never saw such blind fan, apple's version of oled? It's the same oled display ... moreThe Super AMOLED was first used way even back, when Samsung released the first Galaxy S. Till then, they were using OLED and UFB displays.It's 7 years of sAMOLED before Apple.",VicodinER
1499,18-Sep-17,iphone x  would be wroth to  buy  but it cost lot of moeny ,no moeny
1500,18-Sep-17,"guri, 18 Sep 2017New iOS is copy of meeting like swipe from bottom Swip is nokia n9 copy",rahul
1501,18-Sep-17,"imRGZ, 18 Sep 2017It's natural for iFans to follow what Apple says and does. Previously it was screen size, now ... moreLet's not compare with just pure hardware specs. People don't really get it in general. 
It's not the hardware specs that make a product a great one. What you are going to do with the product matters more than raw power. You could have 16 core CPU and a 16GB RAM on your phone but what's the point if you can manage to pull off most tasks that are available today with just 2 or 3GB RAM tops. Take Samsung's face detection based unlock for example. People could easily break it with a simple photo/picture to unlock. Apple has gone really far in order to make face ID fool proof. At least they have attempted. We'll know how secure it is once the phone is out and security enthusiasts take a dig at it.
 
My point is not to criticise you or your opinion. I just wanted add my 2 cents that Apple cares more about the features and it's elegance rather than raw specs.",Anonymous
